{
  "$schema": "https://scds.io/schema/2.0/field.json",
  "id": "0df40543-f72a-5471-a7f1-c85c1f1f93e4",
  "namespace": "governance",
  "name": "protected_status",
  "version": 1,
  "description": "Whether this article is protected from ordinary amendment by the group.",
  "aiGuidance": {
    "purpose": "Flag articles that require external consent (e.g. Party Utility agreement) to amend, beyond the normal group process."
  },
  "valueType": "string",
  "editorHint": "singleline",
  "createdAt": "2026-05-26T00:00:00Z"
}
